

SQL> drop table if exists test_values_t1;

Succeed.

SQL> create table test_values_t1(a int primary key, b int ,c int);

Succeed.

SQL> begin
  2     for i in 1 .. 2000 loop
  3         insert into test_values_t1 values(i,i,i);
  4     end loop;
  5     commit;
  6 end;
  7 /

PL/SQL procedure successfully completed.

SQL> drop table if exists test_values_t2;

Succeed.

SQL> create table test_values_t2(a int primary key, b int ,c int);

Succeed.

SQL> insert into test_values_t2 select a, b * 2, c * 2 from test_values_t1;

2000 rows affected.

SQL> commit;

Succeed.

SQL> 
SQL> select * from test_values_t1 order by a limit 10;

A            B            C           
------------ ------------ ------------
1            1            1           
2            2            2           
3            3            3           
4            4            4           
5            5            5           
6            6            6           
7            7            7           
8            8            8           
9            9            9           
10           10           10          

10 rows fetched.

SQL> 
SQL> insert into test_values_t1 select * from test_values_t2 on duplicate key update b = values(b), c = values(b) + c;

4000 rows affected.

SQL> commit;

Succeed.

SQL> select * from test_values_t1 order by a limit 10;

A            B            C           
------------ ------------ ------------
1            2            3           
2            4            6           
3            6            9           
4            8            12          
5            10           15          
6            12           18          
7            14           21          
8            16           24          
9            18           27          
10           20           30          

10 rows fetched.

SQL> 
SQL> insert into test_values_t1 select a, count(b) as xxx ,max(c) from test_values_t2 group by a on duplicate key update b = values(b), c = values(b) + c;

4000 rows affected.

SQL> commit;

Succeed.

SQL> select * from test_values_t1 order by a limit 10;

A            B            C           
------------ ------------ ------------
1            1            4           
2            1            7           
3            1            10          
4            1            13          
5            1            16          
6            1            19          
7            1            22          
8            1            25          
9            1            28          
10           1            31          

10 rows fetched.

SQL> 
SQL> insert into test_values_t1 select a, count(b) as xxx ,max(c) from test_values_t2 group by a on duplicate key update b = values(b), c = values(b) + values(c);

4000 rows affected.

SQL> commit;

Succeed.

SQL> select * from test_values_t1 order by a limit 10;

A            B            C           
------------ ------------ ------------
1            1            3           
2            1            5           
3            1            7           
4            1            9           
5            1            11          
6            1            13          
7            1            15          
8            1            17          
9            1            19          
10           1            21          

10 rows fetched.

SQL> 
SQL> update test_values_t1 set b = values(b) where a = 1;

1 rows affected.

SQL> commit;

Succeed.

SQL> select * from test_values_t1 order by a limit 10;

A            B            C           
------------ ------------ ------------
1                         3           
2            1            5           
3            1            7           
4            1            9           
5            1            11          
6            1            13          
7            1            15          
8            1            17          
9            1            19          
10           1            21          

10 rows fetched.

SQL> 
SQL> insert into test_values_t1 values (1,2,3) on duplicate key update b = values(d) ;

CT-00601, [1:78]Sql syntax error: invalid column name 'D'
SQL> 
SQL> 
SQL> select values(1);

CT-00601, [1:8]Sql syntax error: function VALUES argument invalid
SQL> select values(a) from test_values_t1  order by a limit 10;

VALUES(A)   
------------
            
            
            
            
            
            
            
            
            
            

10 rows fetched.

SQL> select values(to_char(a)) from test_values_t1;

CT-00601, [1:8]Sql syntax error: function VALUES argument invalid
SQL> drop table if exists test_values_t2;

Succeed.

SQL> drop table if exists test_values_t1;

Succeed.

SQL> 
SQL> drop table if exists test_values_t3;

Succeed.

SQL> create table test_values_t3(a int primary key , b clob);

Succeed.

SQL> insert into test_values_t3 values (1,'aaac');

1 rows affected.

SQL> insert into test_values_t3 values (1, 'dfass') on duplicate key update b = values(b);

CT-00601, [1:76]Sql syntax error: function VALUES argument not support LOB type
SQL> 
SQL> drop table if exists test_values_t4;

Succeed.

SQL> create table test_values_t4(a int primary key , b clob);

Succeed.

SQL> insert into test_values_t4 values (1,'aaac');

1 rows affected.

SQL> insert into test_values_t4 values (1, '123445') on duplicate key update b = values(b);

CT-00601, [1:77]Sql syntax error: function VALUES argument not support LOB type
SQL> 
SQL> drop table if exists test_values_t5;

Succeed.

SQL> create table test_values_t5(a int primary key , b varchar(100));

Succeed.

SQL> insert into test_values_t5 values (1,'aaac');

1 rows affected.

SQL> insert into test_values_t5 select * from test_values_t3 on duplicate key update b = values(b);

2 rows affected.

SQL> insert into test_values_t3 select * from test_values_t5 on duplicate key update b = values(b);

CT-00601, [1:85]Sql syntax error: function VALUES argument not support LOB type
SQL> 
SQL> drop table if exists test_values_t6;

Succeed.

SQL> create table test_values_t6(a int primary key , b image);

Succeed.

SQL> insert into test_values_t6 values (1,'aaac');

1 rows affected.

SQL> insert into test_values_t6 values (1, 'dfass') on duplicate key update b = values(b);

CT-00601, [1:76]Sql syntax error: function VALUES argument not support LOB type
SQL> 
SQL> drop table  if exists test_values_t6;

Succeed.

SQL> drop table  if exists test_values_t5;

Succeed.

SQL> drop table  if exists test_values_t3;

Succeed.

SQL> drop table  if exists test_values_t4;

Succeed.

SQL> 
SQL> drop table if exists test_values_t7;

Succeed.

SQL> create table test_values_t7(a int primary key ,b bigint, c varchar(100), d date, e timestamp, f varbinary(100), g bool);

Succeed.

SQL> begin
  2     for i in 1 .. 2000 loop
  3         insert into test_values_t7 values(i,i,'aaaaa','1990-10-25', '1990-10-25 10:01:02', '1234567890', 1);
  4     end loop;
  5     commit;
  6 end;
  7 /

PL/SQL procedure successfully completed.

SQL> drop table if exists test_values_t8;

Succeed.

SQL> create table test_values_t8(a int primary key ,b bigint, c varchar(100), d date, e timestamp, f varbinary(100), g bool);

Succeed.

SQL> begin
  2     for i in 1 .. 2000 loop
  3         insert into test_values_t8 values(i ,i * 2,'bbbbb','2019-11-22', '2011-11-11 11:11:11', 'abcdef', 0);
  4     end loop;
  5     commit;
  6 end;
  7 /

PL/SQL procedure successfully completed.

SQL> 
SQL> insert into test_values_t7 select * from test_values_t8 on duplicate key update b = values(b), c = values(c), d = values(d), e = values(e), f = values(f), g = values(g);

4000 rows affected.

SQL> commit;

Succeed.

SQL> select * from test_values_t7 order by a limit 10;

A            B                    C                                                                D                      E                                F                                                                G     
------------ -------------------- ---------------------------------------------------------------- ---------------------- -------------------------------- ---------------------------------------------------------------- ------
1            2                    bbbbb                                                            2019-11-22 00:00:00    2011-11-11 11:11:11.000000       abcdef                                                           FALSE 
2            4                    bbbbb                                                            2019-11-22 00:00:00    2011-11-11 11:11:11.000000       abcdef                                                           FALSE 
3            6                    bbbbb                                                            2019-11-22 00:00:00    2011-11-11 11:11:11.000000       abcdef                                                           FALSE 
4            8                    bbbbb                                                            2019-11-22 00:00:00    2011-11-11 11:11:11.000000       abcdef                                                           FALSE 
5            10                   bbbbb                                                            2019-11-22 00:00:00    2011-11-11 11:11:11.000000       abcdef                                                           FALSE 
6            12                   bbbbb                                                            2019-11-22 00:00:00    2011-11-11 11:11:11.000000       abcdef                                                           FALSE 
7            14                   bbbbb                                                            2019-11-22 00:00:00    2011-11-11 11:11:11.000000       abcdef                                                           FALSE 
8            16                   bbbbb                                                            2019-11-22 00:00:00    2011-11-11 11:11:11.000000       abcdef                                                           FALSE 
9            18                   bbbbb                                                            2019-11-22 00:00:00    2011-11-11 11:11:11.000000       abcdef                                                           FALSE 
10           20                   bbbbb                                                            2019-11-22 00:00:00    2011-11-11 11:11:11.000000       abcdef                                                           FALSE 

10 rows fetched.

SQL> select * from test_values_t7 order by a desc limit 10;

A            B                    C                                                                D                      E                                F                                                                G     
------------ -------------------- ---------------------------------------------------------------- ---------------------- -------------------------------- ---------------------------------------------------------------- ------
2000         4000                 bbbbb                                                            2019-11-22 00:00:00    2011-11-11 11:11:11.000000       abcdef                                                           FALSE 
1999         3998                 bbbbb                                                            2019-11-22 00:00:00    2011-11-11 11:11:11.000000       abcdef                                                           FALSE 
1998         3996                 bbbbb                                                            2019-11-22 00:00:00    2011-11-11 11:11:11.000000       abcdef                                                           FALSE 
1997         3994                 bbbbb                                                            2019-11-22 00:00:00    2011-11-11 11:11:11.000000       abcdef                                                           FALSE 
1996         3992                 bbbbb                                                            2019-11-22 00:00:00    2011-11-11 11:11:11.000000       abcdef                                                           FALSE 
1995         3990                 bbbbb                                                            2019-11-22 00:00:00    2011-11-11 11:11:11.000000       abcdef                                                           FALSE 
1994         3988                 bbbbb                                                            2019-11-22 00:00:00    2011-11-11 11:11:11.000000       abcdef                                                           FALSE 
1993         3986                 bbbbb                                                            2019-11-22 00:00:00    2011-11-11 11:11:11.000000       abcdef                                                           FALSE 
1992         3984                 bbbbb                                                            2019-11-22 00:00:00    2011-11-11 11:11:11.000000       abcdef                                                           FALSE 
1991         3982                 bbbbb                                                            2019-11-22 00:00:00    2011-11-11 11:11:11.000000       abcdef                                                           FALSE 

10 rows fetched.

SQL> drop table if exists test_values_t7;

Succeed.

SQL> drop table if exists test_values_t8;

Succeed.

SQL> 


