

SQL> drop table if exists t_res_sysdate;

Succeed.

SQL> create table t_res_sysdate(curdate date, current_date date, current_timestamp timestamp, systimestamp timestamp);

Succeed.

SQL> insert into t_res_sysdate values(curdate, current_date, current_timestamp, systimestamp+1);

1 rows affected.

SQL> select sleep(1);

SLEEP(1)
--------
        

1 rows fetched.

SQL> select curdate, current_date, current_timestamp, systimestamp from t_res_sysdate where curdate=sysdate;

CURDATE                CURRENT_DATE           CURRENT_TIMESTAMP                SYSTIMESTAMP                    
---------------------- ---------------------- -------------------------------- --------------------------------

0 rows fetched.

SQL> --select curdate-current_date, current_timestamp-systimestamp from t_res_sysdate where curdate=current_date;
SQL> update t_res_sysdate set curdate = sysdate,current_date=sysdate;

1 rows affected.

SQL> 
SQL> drop table if exists t_res_bool;

Succeed.

SQL> create table t_res_bool(true bool, false bool);

CT-00601, [1:25]Sql syntax error: invalid column name 'true'
SQL> insert into t_res_bool values(true,false),(0,1);

CT-00843, [1:13]The table or view SYS.T_RES_BOOL does not exist.
SQL> select true,false from t_res_bool where true=0;

CT-00843, [1:24]The table or view SYS.T_RES_BOOL does not exist.
SQL> select true,false from t_res_bool where false=0;

CT-00843, [1:24]The table or view SYS.T_RES_BOOL does not exist.
SQL> 
SQL> drop table if exists t_res_unit;

Succeed.

SQL> create table t_res_unit(year int, month int, day int, hour int, minute int, second int, microsecond int, quarter int, week int);

Succeed.

SQL> insert into t_res_unit values(2018,8,24,11,22,33,444440,3,7);

1 rows affected.

SQL> select year,month,day,hour,minute,second from t_res_unit;

YEAR         MONTH        DAY          HOUR         MINUTE       SECOND      
------------ ------------ ------------ ------------ ------------ ------------
2018         8            24           11           22           33          

1 rows fetched.

SQL> 
SQL> drop table if exists t_res_dml;

Succeed.

SQL> create table t_res_dml(inserting int, deleting int, updating int);

Succeed.

SQL> insert into t_res_dml values(1,2,3);

1 rows affected.

SQL> select inserting,deleting,updating from t_res_dml;

INSERTING    DELETING     UPDATING    
------------ ------------ ------------
1            2            3           

1 rows fetched.

SQL> 
SQL> drop table if exists t_res_connby;

Succeed.

SQL> create table t_res_connby(connect_by_iscycle int, connect_by_isleaf int);

Succeed.

SQL> insert into t_res_connby values(1,2),(3,4);

2 rows affected.

SQL> select connect_by_iscycle, connect_by_isleaf from t_res_connby order by connect_by_iscycle;

CONNECT_BY_ISCYCLE CONNECT_BY_ISLEAF
------------------ -----------------
1                  2                
3                  4                

2 rows fetched.

SQL> 
SQL> 
SQL> drop table if exists t_res_rowscn;

Succeed.

SQL> drop table if exists t_res_rowscn2;

Succeed.

SQL> create table t_res_rowscn(i bigint) crmode row;

Succeed.

SQL> insert into t_res_rowscn values(1),(2);

2 rows affected.

SQL> commit;

Succeed.

SQL> insert into t_res_rowscn values(3),(4),(5);

3 rows affected.

SQL> commit;

Succeed.

SQL> insert into t_res_rowscn values(6);

1 rows affected.

SQL> insert into t_res_rowscn values(7);

1 rows affected.

SQL> insert into t_res_rowscn values(8);

1 rows affected.

SQL> insert into t_res_rowscn values(9);

1 rows affected.

SQL> commit;

Succeed.

SQL> select count(*) from t_res_rowscn group by rowscn order by rowscn;

COUNT(*)            
--------------------
2                   
3                   
4                   

3 rows fetched.

SQL> update t_res_rowscn set i=10 where rowscn = 1;

0 rows affected.

SQL> --error:
SQL> insert into t_res_rowscn values(rowscn);

CT-00601, [1:33]Sql syntax error: unexpected rowscn occurs
SQL> select * from t_res_rowscn limit rowscn;

CT-00601, [1:34]Sql syntax error: unexpected rowscn occurs
SQL> --support update
SQL> update t_res_rowscn set rowscn = 1;

CT-01358, [1:25]Expect user.table.column, table.column, or column specification here
SQL> --change scn
SQL> update t_res_rowscn set i=10 where rowscn in (select rowscn from t_res_rowscn where i < 4);

5 rows affected.

SQL> commit;

Succeed.

SQL> select i,count(*) from t_res_rowscn group by rowscn, i order by rowscn, i;

I                    COUNT(*)            
-------------------- --------------------
6                    1                   
7                    1                   
8                    1                   
9                    1                   
10                   5                   

5 rows fetched.

SQL> update t_res_rowscn set i = rowscn;

9 rows affected.

SQL> select count(*) from t_res_rowscn group by i order by i;

COUNT(*)            
--------------------
4                   
5                   

2 rows fetched.

SQL> create table t_res_rowscn2 as select rowscn,i from t_res_rowscn;

CT-00601, Sql syntax error: must name expression with a column alias
SQL> create table t_res_rowscn2 as select rowscn r,i from t_res_rowscn;

Succeed.

SQL> 


